{
  "id": "gaam:mapping:eudi-arf:3.0.0:2026-08-10",
  "gaamVersion": "0.9.0",
  "normativeStatus": "informative",
  "assessmentType": "readiness-crosswalk",
  "target": {
    "name": "EU Digital Identity Wallet Architecture and Reference Framework",
    "version": "3.0.0",
    "source": "https://github.com/eu-digital-identity-wallet/eudi-doc-architecture-and-reference-framework",
    "assessedAt": "2026-08-10"
  },
  "method": {
    "statusVocabulary": [
      "covered",
      "partial",
      "gap",
      "not-applicable",
      "unknown"
    ],
    "claimBoundary": "Readiness mapping only. No EUDI compliance, certification, formal audit or GAAM conformance claim is made."
  },
  "findings": [
    {
      "id": "GAAM-ARF-01",
      "title": "Action-level authority is not uniformly represented",
      "status": "partial",
      "gaamRequirements": [
        "GAAM-AUTH-001",
        "GAAM-AUTH-002",
        "GAAM-AUTH-003",
        "GAAM-EFF-002"
      ],
      "observation": "Authority is often derived from role, registration, certification, trusted-list state and protocol rules rather than one common action-level representation.",
      "actionableTakeaway": "Model authority as a resolvable tuple of source, actor, action, subject or resource, scope, constraints, validity and revocation state where consequential effects depend on authority.",
      "evidenceExpectation": [
        "authority-source reference",
        "scope and constraint record",
        "current authority status"
      ],
      "candidateTests": [
        "reject valid identity without action authority",
        "reject authority outside declared scope",
        "accept authority only while source and status remain valid"
      ],
      "governanceContext": {
        "authoritySources": [
          "EU legislation",
          "ARF requirements",
          "national governance",
          "protocol rules"
        ],
        "governedActors": [
          "ecosystem actor",
          "relying party"
        ],
        "governedRelationships": [
          "action-level authority"
        ],
        "governedEffects": [
          "consequential action"
        ],
        "enforcement": [
          "role, registration, certification and protocol checks"
        ],
        "revocation": [
          "status withdrawal or expiry"
        ],
        "assuranceMechanisms": [
          "credential, registry and certification evidence"
        ]
      },
      "semantics": {
        "establishes": [
          "recognition or status facts within source scope"
        ],
        "doesNotEstablish": [
          "action-specific authority unless explicitly established"
        ]
      },
      "knownLimitations": [
        "This finding is derived from a governance-framework readiness review, not observed implementation behaviour.",
        "The mapped status does not establish GAAM conformance."
      ]
    },
    {
      "id": "GAAM-ARF-02",
      "title": "Role authority is distributed across governance sources",
      "status": "partial",
      "gaamRequirements": [
        "GAAM-AUTH-001",
        "GAAM-AUTH-002",
        "GAAM-EVID-001"
      ],
      "observation": "Role definitions and their operative authority can depend on legislation, implementing acts, ARF requirements, certification and national arrangements.",
      "actionableTakeaway": "Publish a role-to-authority register that resolves each governed role to authority sources, permitted effects, constraints and lifecycle conditions.",
      "evidenceExpectation": [
        "role definition",
        "authority-source mapping",
        "lifecycle and jurisdiction metadata"
      ],
      "candidateTests": [
        "resolve every consequential role to at least one authority source",
        "detect conflicting or missing role-authority mappings"
      ],
      "governanceContext": {
        "authoritySources": [
          "EU legislation",
          "implementing acts",
          "ARF requirements",
          "national governance"
        ],
        "governedActors": [
          "defined ecosystem role"
        ],
        "governedRelationships": [
          "role-to-authority mapping"
        ],
        "governedEffects": [
          "role-dependent action"
        ],
        "enforcement": [
          "scheme and national rules"
        ],
        "revocation": [
          "role or registration lifecycle"
        ],
        "assuranceMechanisms": [
          "role definition and authority-source evidence"
        ]
      },
      "semantics": {
        "establishes": [
          "role identity and applicable governance sources"
        ],
        "doesNotEstablish": [
          "uniform authority independent of jurisdiction or rule source"
        ]
      },
      "knownLimitations": [
        "This finding is derived from a governance-framework readiness review, not observed implementation behaviour.",
        "The mapped status does not establish GAAM conformance."
      ]
    },
    {
      "id": "GAAM-ARF-03",
      "title": "Authority conflict and precedence require explicit treatment",
      "status": "partial",
      "gaamRequirements": [
        "GAAM-AUTH-006",
        "GAAM-AUTH-007"
      ],
      "observation": "Several legitimate legal, supervisory, certification and technical authority sources can apply simultaneously.",
      "actionableTakeaway": "Represent precedence, coordination, refusal and escalation rules for overlapping authority sources as explicit governance data.",
      "evidenceExpectation": [
        "authority precedence rule",
        "conflict-resolution procedure",
        "escalation authority"
      ],
      "candidateTests": [
        "resolve two applicable authorities with conflicting outcomes",
        "fail closed when precedence is undefined"
      ],
      "governanceContext": {
        "authoritySources": [
          "EU legislation",
          "implementing acts",
          "national supervision",
          "certification schemes",
          "Trusted Lists",
          "protocol state"
        ],
        "governedActors": [
          "governed ecosystem actors"
        ],
        "governedRelationships": [
          "authority precedence",
          "authority conflict"
        ],
        "governedEffects": [
          "runtime governance outcome"
        ],
        "enforcement": [
          "precedence and escalation rules"
        ],
        "revocation": [
          "supersession or withdrawal of authority source"
        ],
        "assuranceMechanisms": [
          "source provenance and current status"
        ]
      },
      "semantics": {
        "establishes": [
          "coexisting legitimate authority sources"
        ],
        "doesNotEstablish": [
          "deterministic precedence when no rule is declared"
        ]
      },
      "knownLimitations": [
        "This finding is derived from a governance-framework readiness review, not observed implementation behaviour.",
        "The mapped status does not establish GAAM conformance."
      ]
    },
    {
      "id": "GAAM-ARF-04",
      "title": "Runtime governance decisions lack a common decision envelope",
      "status": "partial",
      "gaamRequirements": [
        "GAAM-EFF-002",
        "GAAM-EVID-002",
        "GAAM-EVID-003"
      ],
      "observation": "Protocol validation is substantial, but no general envelope consistently records the authority, rule, evidence, constraints and decision behind a consequential effect.",
      "actionableTakeaway": "Define a privacy-minimised runtime governance envelope for consequential decisions, preserving resolvable evidence references instead of unnecessary transaction data.",
      "evidenceExpectation": [
        "policy version",
        "authority reference",
        "evidence references",
        "decision outcome and time"
      ],
      "candidateTests": [
        "decision cannot be reconstructed when required evidence is absent",
        "stale evidence triggers configured denial, restriction or review"
      ],
      "governanceContext": {
        "authoritySources": [
          "applicable legal and ARF governance"
        ],
        "governedActors": [
          "wallet provider",
          "issuer",
          "relying party"
        ],
        "governedRelationships": [
          "runtime governance decision"
        ],
        "governedEffects": [
          "permitted or rejected consequential action"
        ],
        "enforcement": [
          "protocol validation",
          "policy evaluation"
        ],
        "revocation": [
          "policy or authority-state change"
        ],
        "assuranceMechanisms": [
          "authority, evidence and policy references"
        ]
      },
      "semantics": {
        "establishes": [
          "decision basis when recorded"
        ],
        "doesNotEstablish": [
          "privacy-safe accountability if excessive transaction data is logged"
        ]
      },
      "knownLimitations": [
        "This finding is derived from a governance-framework readiness review, not observed implementation behaviour.",
        "The mapped status does not establish GAAM conformance."
      ]
    },
    {
      "id": "GAAM-ARF-05",
      "title": "Decision receipts are not systemic",
      "status": "gap",
      "gaamRequirements": [
        "GAAM-EVID-002",
        "GAAM-ASSUR-002"
      ],
      "observation": "There is no general privacy-preserving receipt connecting a material effect to the authority and evidence supporting the decision.",
      "actionableTakeaway": "Prototype bounded decision receipts that expose accountability evidence without creating a cross-context correlation layer.",
      "evidenceExpectation": [
        "decision identifier",
        "authority and policy references",
        "minimal integrity-protected outcome record"
      ],
      "candidateTests": [
        "receipt supports independent reconstruction of the declared decision basis",